{
  "artifact_id": "ev-example-001",
  "artifact_type": "terrain_dem",
  "source_authority": "USGS",
  "source_uri": "https://www.usgs.gov/3d-elevation-program",
  "retrieved_at": "2026-09-25T12:00:00Z",
  "spatial_reference": {
    "horizontal_crs": "EPSG:2966"
  },
  "vertical_reference": {
    "vertical_datum": "NAVD88"
  },
  "content_hash_sha256": "0123456789abcdef0123456789abcdef0123456789abcdef0123456789abcdef",
  "parent_artifacts": [],
  "transformation_chain": [],
  "validation_status": "provisional",
  "authority_class": "OBSERVATION",
  "derivation_class": "RAW",
  "governance_status": "human_review_required"
}
